Area,Activity,Sex ,Age,Injury,Fatal (Y/N),Time,Species 
Shatt-al-Arab River,UNKNOWN,M,13,"FATAL, right arm  severely bitten & surgically amputated, died 12 to 14 hours later   ",Y,UNKNOWN,UNKNOWN
Shatt-al-Arab River,Swimming,M,15,"Quadriceps lacerated, femur exposed",N,UNKNOWN,UNKNOWN
Bimini Islands,Spearing a shark,M,41,Shark that he speared bit his calf     PROVOKED INCIDENT,N,UNKNOWN,"Lemon shark, 4"
US Virgin Islands,Swimming,M,46,FATAL,Y,UNKNOWN,UNKNOWN
Saipan,Swimming,M,UNKNOWN,Heel bitten,N,UNKNOWN,UNKNOWN
Shatt-al-Arab River,"Fishing, shark caught in his net",M,38,"8"" x 4"" left antecubital fossa of muscle & skin removed  PROVOKED INCIDENT",N,UNKNOWN,UNKNOWN
Western Cape Province,"Bringing hooked, harpooned shark onboard boat",M,UNKNOWN,Groenwalds arm lacerated by the shark PROVOKED INCIDENT,N,UNKNOWN,UNKNOWN
Coast Province,UNKNOWN,M,UNKNOWN,FATAL,Y,UNKNOWN,UNKNOWN
Cap Vert Peninsula,UNKNOWN,UNKNOWN,UNKNOWN,Fragment of human foot recovered from 300-kg [662-lb] tiger shark,UNKNOWN,UNKNOWN,Shark involvement prior to death not confirmed
"New Ireland Province, Bismarck Archipelago",Spearfishing,M,30,Leg bitten by shark that he had speared  PROVOKED INCIDENT,N,UNKNOWN,"""grey shark"""
Texas,"C47 aircraft carrying 5,000 lbs of ice ditched in the sea",M,UNKNOWN,"FATAL. Womack was injured when plane went down, 3 days later he fell off liferaft & was taken by a shark  ",Y,UNKNOWN,UNKNOWN
New South Wales,Swimming,M,16,"FATAL, right thigh & leg bitten ",Y,UNKNOWN,3.7 m [12] shark
New South Wales,Surf skiing,M,UNKNOWN,"No injury, ski bitten",N,UNKNOWN,6 shark
Florida,Underwater photography,M,48,Grabbed shark by the tail & it bit him PROVOKED INCIDENT,N,Afternoon,Nurse shark
Morobe Province,"Fishing, holding fish in right hand",M,UNKNOWN,Right hand bitten,N,UNKNOWN,UNKNOWN
Bougainville (North Solomons),Spearfishing,M,UNKNOWN,Bitten on face while taking shark off spear PROVOKED INCIDENT,N,UNKNOWN,UNKNOWN
Western Cape Province,Fishing,UNKNOWN,UNKNOWN,"No injury to occupants, boat holed by shark",N,UNKNOWN,UNKNOWN
New South Wales,Fishing,M,9,Leg gashed,N,P.M.,Grey nurse shark
KwaZulu-Natal,UNKNOWN,UNKNOWN,UNKNOWN,"Human remains, possibly one of the crew of the wrecked fishing boat John Bull. found in 277-kg tiger shark.",UNKNOWN,UNKNOWN,Shark involvement prior to death not confirmed
UNKNOWN,Fishing / diving,M,UNKNOWN,"FATAL, right thigh bitten ",Y,11h00,Tiger shark
South Australia,Fishing,UNKNOWN,UNKNOWN,"No injury to occupants, shark made 20 to 30 rushes at dinghy",N,UNKNOWN,5.5 m [18] shark
New South Wales,Fishing from surf ski,M,17,"No injury, ski bumped",N,Dusk,UNKNOWN
New South Wales,Fishing from surf ski,M,16,"No injury, ski bumped",N,Dusk,UNKNOWN
New South Wales,Swimming,M,12,"FATAL, leg severed at knee  ",Y,16h00,UNKNOWN
New South Wales,Swimming,M,13,Thighs & knee lacerated,N,16h00,UNKNOWN
Queensland,UNKNOWN,M,78,FATAL,Y,UNKNOWN,UNKNOWN
Northern Territory,Fishing in waist-deep water,M,UNKNOWN,Kneecap removed,N,UNKNOWN,UNKNOWN
Pernambuco,Swimming ,M,25,FATAL,Y,UNKNOWN,UNKNOWN
Florida,Swimming,M,20,"FATAL, calf bitten, leg surgically amputated  ",Y,UNKNOWN,Possibly C. leucas
California,Fishing,M,46,PROVOKED INCIDENT,N,UNKNOWN,a small shark
Northern Territory,Diving,M,UNKNOWN,Suit ripped,N,UNKNOWN,"Most likely, a small shark"
KwaZulu-Natal,Swimming,M,20,Right thigh lacerated,N,Morning,UNKNOWN
Carpathian Sea,Jumped overboard ,M,UNKNOWN,Shark involvement  unconfirmed,UNKNOWN,UNKNOWN,Questionable
Hawaii,Fishing,M,35,"Left forearm, arm & leg lacerated",N,10h30,UNKNOWN
New South Wales,Fishing,UNKNOWN,UNKNOWN,"No injury to occupants, shark bumped & lifted dinghy",N,UNKNOWN,"Tiger shark, 14 "
Coast Province,Swimming,M,UNKNOWN,Knee grazed,N,UNKNOWN,UNKNOWN
KwaZulu-Natal,Treading water,M,21,Ankle & shin lacerated,N,12h00,"1.5 m, 45-kg shark"
KwaZulu-Natal,Body surfing,M,14,"Thigh severely lacerated, shin & calf lacerated",N,17h30,UNKNOWN
New South Wales,Surfing,M,17,"No injury, board scraped by shark",N,UNKNOWN,UNKNOWN
UNKNOWN,"Moving shark from tuna vessel when boat rolled, placing both man & shark in chest-deep water",M,29,"Right arm punctured, finger lacerated PROVOKED INCIDENT",N,11h00,UNKNOWN
KwaZulu-Natal,Wading,M,18,"Hip abraded, right calf severely lacerated",N,16h10,UNKNOWN
KwaZulu-Natal,Treading water,M,22,Lacerations on buttock  &  right foot ,N,12h00,"Blacktip shark, 2 m [6.75] "
Queensland,Fishing,UNKNOWN,UNKNOWN,"No injury, shark holed boat",N,UNKNOWN,UNKNOWN
New Providence Island,Attempting to ride a shark,M,UNKNOWN,Arm bitten PROVOKED INCIDENT,N,UNKNOWN,5 shark
Rio de Janeiro,Bathing,UNKNOWN,UNKNOWN,FATAL,Y,UNKNOWN,UNKNOWN
New South Wales,Rowing,UNKNOWN,UNKNOWN,"No injury, shark lifted the boat 0.5 m out of the water",N,UNKNOWN,"4.5  m [149""] shark"
KwaZulu-Natal,Treading water,M,18,Flexed left leg lacerated,N,15h50,>1.6 m shark
South Australia,Swimming near jetty with 2 piece of wood,M,23,"Forearm & fingers lacerated, teethmarks on wood",N,UNKNOWN,UNKNOWN
Queensland,UNKNOWN,UNKNOWN,UNKNOWN,Shark jumped into cockpit,N,UNKNOWN,7 shark
Torres Strait,Pearl diving from lugger,M,30,"FATAL, right arm severed",Y,UNKNOWN,UNKNOWN
Kwajalein,Fishing,M,UNKNOWN,FATAL,Y,UNKNOWN,UNKNOWN
New South Wales,Swimming,M,15,Left leg lacerated,N,UNKNOWN,UNKNOWN
Gaza,Fishing,M,15,Laceration to back,N,UNKNOWN,UNKNOWN
Queensland,Swimming after a tennis ball,M,30,"FATAL, body not recovered",Y,15h20,4.3 m [14] shark
Khuzestan Province,"Fishing, probably with a net",M,12,Radius & ulna bared,N,UNKNOWN,UNKNOWN
Khuzestan Province,Swimming ,M,12,"Left Achilles tendon severed, calf muscles severely lacerated",N,UNKNOWN,Possibly C. leucas
UNKNOWN,Bathing,M,14,"""Serious injuries""",N,UNKNOWN,UNKNOWN
Dar-es-Salaam ,Swimming ,M,UNKNOWN,Leg bitten,N,UNKNOWN,UNKNOWN
Queensland,Swimming,M,17,FATAL,Y,13h30,UNKNOWN
South Australia,Fishing,UNKNOWN,UNKNOWN,"No injury to occupants. Shark charged boat, tore off rudder & tossed it air, then swam off with it",N,UNKNOWN,6 m [20]  shark
South Australia,Fishing,M,28,"No injury; shark rammed boat, catapulting Leverenz in the sea & damaging boat",N,19h00,UNKNOWN
KwaZulu-Natal,Treading water,M,21,Right arm severely lacerated,N,16h00,UNKNOWN
Western Australia,Standing,M,18,"Leg bitten, surgically amputated",N,12h15,"White shark, 4.2 m [139""] "
KwaZulu-Natal,Swimming ,M,18,Flexed right  knee bitten,N,09h15,UNKNOWN
KwaZulu-Natal,Treading water,M,15,Knee & calf lacerated,N,17h15,UNKNOWN
KwaZulu-Natal,Swimming,M,UNKNOWN,Foot severely lacerated,N,Afternoon,UNKNOWN
Queensland,UNKNOWN,M,12,Ankle bitten,N,UNKNOWN,small shark
Western Cape Province,Jumping in swells,M,18,Foot bitten,N,12h00,1.5 m [5] shark
New South Wales,Swimming,F,14,"FATAL, left leg severed, right leg injured  ",Y,UNKNOWN,UNKNOWN
Eastern Cape Province,Body surfing,M,24,Calf lacerated,N,UNKNOWN,UNKNOWN
Western Cape Province,UNKNOWN,UNKNOWN,UNKNOWN,"No injury to occupants, shark struck boats+K1581",N,UNKNOWN,UNKNOWN
Western Cape Province,UNKNOWN,UNKNOWN,UNKNOWN,"Shark holed and sank boat, occupants rescued",N,UNKNOWN,UNKNOWN
"""Head of the Gulf""",Bitten after dhow shipwrecked,F,UNKNOWN,"Abdomen bitten, but she survived. Most of the 40 others that survived the wreck, were taken by sharks",N,UNKNOWN,UNKNOWN
UNKNOWN,Bathing,M,UNKNOWN,FATAL,Y,UNKNOWN,UNKNOWN
UNKNOWN,American minesweeper USS YMS-472 foundered in a typhoon - swimming to shore,M,20,Laceration to arm,N,UNKNOWN,UNKNOWN
Ryukyu,American minesweeper USS YMS-350 lost in a typhoon - swimming to shore,M,UNKNOWN,FATAL,Y,UNKNOWN,UNKNOWN
Shatt-al-Arab River,Swimming,M,13,"Right forearm injured, mid-humeral amputation",N,UNKNOWN,UNKNOWN
Shatt-al-Arab River,UNKNOWN,M,UNKNOWN,Lower left leg amputated,N,UNKNOWN,UNKNOWN
 North Carolina,UNKNOWN,UNKNOWN,UNKNOWN,FATAL,Y,UNKNOWN,UNKNOWN
In transit between Tinian and Leyte,American cruiser Indianapolis torpedoed & sunk by the Japanese submarine I-58,UNKNOWN,UNKNOWN,"About 300  crew perished during the sinking, the remainder abandoned ship. Many who survived the loss of the ship were taken by sharks. In all, only 316 of her crew of 1,196 survived.",Y,UNKNOWN,UNKNOWN
Northern Java,"90 European civilians, many women & children, were placed on the deck of a Japanese submarine that submerged when it was well offshore",UNKNOWN,UNKNOWN,Sharks attacked the swimmers. The sole survivor lost his arm & foot & died of his injuries shortly after being picked up  by Javanese fishermen. The incident became known as the Cheribon Atrocity,Y,Dusk,UNKNOWN
Queensland,Swimming,M,UNKNOWN,FATAL,Y,16h00,UNKNOWN
North Carolina,Swimming,M,UNKNOWN,"FATAL, large gash to thigh",Y,UNKNOWN,UNKNOWN
KwaZulu-Natal,Walking,M,37,"Right leg bitten knee to foot, surgically amputated",N,16h30,Thought to involve a Zambesi shark
Tel Aviv,Swimming,M,UNKNOWN,"Survived. R.A.F. pilot, seeing commotion in the water, dived his plane to investigate and scared off shark",N,UNKNOWN,UNKNOWN
UNKNOWN,Diving,M,UNKNOWN,Hand severed,N,UNKNOWN,UNKNOWN
Havana Province,"Playing on rock, slipped & fell into the water",M,UNKNOWN,FATAL,Y,UNKNOWN,UNKNOWN
Colon Province,Bathing with her mother,F,UNKNOWN,Foot bitten,N,UNKNOWN,UNKNOWN
Basrah,Swimming,M,15,Left foot bitten,N,12h00,Bull shark
300 miles east of Luzon,Swimming near life raft,M,19,Arm bitten,N,UNKNOWN,9 shark
Florida,Fishing for mackerel,UNKNOWN,UNKNOWN,"No injury to occupants. After being prodded with an oar, shark struck bow and sank boat PROVOKED INCIDENT",N,UNKNOWN,"Tiger shark, 4.5 to 5.5 m [149"" to 18], 2000-lb  "
Western Area,UNKNOWN,M,18,FATAL,Y,UNKNOWN,UNKNOWN
Queensland,Swimming,M,UNKNOWN,Probable drowning & scavenging,UNKNOWN,UNKNOWN,UNKNOWN
UNKNOWN,"USS Gambier Bay CVE-73  shelled & sunk  at 09h57 on 10/24/1944, by Japanes fleet enroute to attack the Allied landing force at Leyte.",M,UNKNOWN,When survivors werer rescued on 10/27/1944 by PC 623 there were many sharks in the area,Y,UNKNOWN,UNKNOWN
Bernardino Strait near Gulf of Leyte,USS Hoel DD 533 sunk on 10/24/1944 in the Battle off Samar. 2 crewmen were swimmng alongside a floater net &,M,UNKNOWN,"FATAL, both were killed by sharks",Y,UNKNOWN,UNKNOWN
Off Samar Island in the Gulf of Leyte,USS Johnston DD 557 sunk on 10/24/1944 in the Battle off Samara. Crewmen were swimming beside a raft.,M,UNKNOWN,"Clinton was bitten on his back, 2 others did not survive",Y,UNKNOWN,UNKNOWN
UNKNOWN,Parachuted into Pacific,M,UNKNOWN,"Shark grazed leg, leaving toothmarks",N,UNKNOWN,UNKNOWN
UNKNOWN,Japanese POW ship Arisan Maru with 1800 American prisoners of war on board bound for slave labor camps was torpedoed by an American submarine,M,UNKNOWN,Most of the men drowned & some were taken by sharks. Only only nine men survived,Y,UNKNOWN,UNKNOWN
Queensland,Fishing,UNKNOWN,UNKNOWN,No injury to occupants; shark bit dinghy leaving tooth fragments in  its woodwork,N,UNKNOWN,UNKNOWN
Maryland,Swimming,M,13,Laceration to right lower leg,N,UNKNOWN,UNKNOWN
UNKNOWN,Fell overboard from US Navy PC boat,M,UNKNOWN,FATAL,Y,UNKNOWN,UNKNOWN
KwaZulu-Natal,Swimming ,M,19,"FATAL, body not recovered",Y,14h00,UNKNOWN
Western Cape Province,Swimming,M,17,"FATAL, body not recovered",Y,16h30,"White shark, according to witnesses"
UNKNOWN,UNKNOWN,M,UNKNOWN,"When picked up by the USS Boyd DD 44 on 6/23/1944 his raft was ""surrounded by sharks""",UNKNOWN,UNKNOWN,Invalid
Florida,Bathing,F,15,Left calf bitten,N,UNKNOWN,1.8 m [6] blacktip shark or spinner shark
UNKNOWN,UNKNOWN,UNKNOWN,UNKNOWN,Minor injury when shark tore off his boot,N,UNKNOWN,5 shark
Caribbean Sea,Washed overboard by swell,M,UNKNOWN,"FATAL. His back was bitten as he was being towed to ship by rescuer, Lieut (j.g.) Stanley Kurta, then the shark pulled him below the surface. ",Y,UNKNOWN,"White shark, 2.4 m [8] "
Lake Nicaragua (fresh water),UNKNOWN,UNKNOWN,UNKNOWN,Some killed & others severely injured,Y,UNKNOWN,Bull sharks to 1.5 m [5]  in length
KwaZulu-Natal,Treading water,M,18,Left thigh bitten,N,17h30,UNKNOWN
KwaZulu-Natal,Standing,M,23,"FATAL, left thigh & calf bitten  ",Y,10h00,UNKNOWN
KwaZulu-Natal,Treading water,M,16,Ankle severely lacerated,N,17h30,UNKNOWN
Western Cape Province,Treading water,M,UNKNOWN,Foot & ankle lacerated,N,UNKNOWN,2.1 m [7] shark
UNKNOWN,Bathing,M,12,FATAL,Y,UNKNOWN,UNKNOWN
KwaZulu-Natal,Body surfing,M,22,"FATAL, right thigh lacerated, femoral artery severed ",Y,13h15,UNKNOWN
Western Australia,Fishing,M,UNKNOWN,"No injury, shark took days catch & struck boat",N,UNKNOWN,14 shark
New South Wales,Surfing,M,14,"Both legs bitten, one surgically amputated",N,17h00,UNKNOWN
KwaZulu-Natal,Swimming,M,26,"FATAL, leg bitten knee to ankle & posterior tibial artery severed; died of toxemia 2 days later ",Y,17h50,UNKNOWN
UNKNOWN,Adrift on raft,M,UNKNOWN,FATAL            Arm severed,Y,UNKNOWN,UNKNOWN
Adriatic Sea,B-24 aircraft crashed  into the sea,M,UNKNOWN,FATAL,Y,UNKNOWN,UNKNOWN
Pacific Ocean,Fell overboard from USS Ward,M,UNKNOWN,FATAL,Y,UNKNOWN,UNKNOWN
KwaZulu-Natal,Treading water,M,17,"FATAL, abdomen, buttock & thigh lacerated  ",Y,11h30,UNKNOWN
South Carolina,The Cuban freighter Libertad was torpedoed and sunk by the German submarine U-129,M,UNKNOWN,"Of the 18 crew who survived the sinking, 10 were taken by sharks. Cabarrocas was bitten but survived",Y,UNKNOWN,UNKNOWN
Eastern Cape Province,Swimming with board,M,UNKNOWN,Right foot lacerated,N,UNKNOWN,UNKNOWN
Near the Fiji Islands,The 6711-ton American freighter & troop transport Cape San Juan was torpedoed by the Japanese submarine I-21,M,UNKNOWN,"Of the 1,429 people on board, only 448 survived. Sharks were attacking survivors as they were being rescued",Y,UNKNOWN,UNKNOWN
Florida,UNKNOWN,M,UNKNOWN,"Hand, forearm, leg and pelvis recovered from 4.25 m  [14] shark caught at Baker’s Haulover, Miami Beach on 26-Oct-1943",UNKNOWN,UNKNOWN,Shark involvement prior to death unconfirmed
Gulf of Panama,Dived overboard to check propeller of US Navy motor torpedo boat,M,20,"FATAL, left leg  & shoulder bitten  ",Y,14h35,"White shark, 2 m [69""]  (Tooth fragment recovered from victims shoulder & identified by J.T. Nicholls)"
40 miles south of Naples ,Flying Fortress bomber aircraft went down after daytime raid on Naples. He was swimming on the surface,M,UNKNOWN,"Bitten on arms, hands & feet while awaiting rescue",N,UNKNOWN,UNKNOWN
Florida,Treading water after survivng crash of the US Navy airship K-74 that was hit by the German submarine U-134,M,UNKNOWN,FATAL,Y,UNKNOWN,UNKNOWN
UNKNOWN,Fishing for mackerel,UNKNOWN,UNKNOWN,No injury to occupants,N,UNKNOWN,UNKNOWN
Veracruz,Swimming,M,68,"No injury, a shark made a threat display",UNKNOWN,UNKNOWN,Invalid
Tasmania,Fishing for cod,M,18,"No injury to occupant, shark grabbed rudder and dragged the dinghy stern-first",N,UNKNOWN,"White shark, 3.9 m, 550 kg, male"
UNKNOWN,B-24 crashed during a search mission. Survivors in raft for 47 days ,M,UNKNOWN,Survived,UNKNOWN,UNKNOWN,Invalid
UNKNOWN,"S2N Navy scout plane went down, E.H. Almond & Lieut A.G. Reading in water",M,26,"Jaw dislocated & contusions from many blows on legs & body by shark fins, rescued after 14 hours",N,UNKNOWN,UNKNOWN
UNKNOWN,"S2N Navy scout plane went down, E.H. Almond & Lieut A.G. Reading in water",M,UNKNOWN,"FATAL, right leg & left thigh bitten  ",Y,UNKNOWN,UNKNOWN
Queensland,Hospital Ship Centaur torpedoed & sunk by the Japanese submarine I-177,M,UNKNOWN,FATAL,Y,UNKNOWN,UNKNOWN
UNKNOWN,ship torpedoed 400 miles off the African coas. Man was clinging to hatch cover,M,UNKNOWN,"Leg, foot & arm bitten",N,UNKNOWN,Blue shark
Hawaii,"Small boat swamped, 4  people swimming to shore but he fell behind the other 3 and vanished",M,UNKNOWN,On 29-Apr-1943 his remains (right forearm & swim trunks) were found in 4.9 m [16] shark’s gut,UNKNOWN,UNKNOWN,Shark involvement prior to death unconfirmed
KwaZulu-Natal,Swimming,M,31,"FATAL, thigh lacerated, both calves bitten  ",Y,16h10,UNKNOWN
UNKNOWN,"The 21,516-ton troopship Empress of Canada torpedoed and sunk by the Italian submarine Leonardo da Vinci",UNKNOWN,UNKNOWN,"Of the 1346 on board, 392 perished including 90 women & 44 crew. 1 person known to have been fatally injured by a shark.",Y,UNKNOWN,UNKNOWN
UNKNOWN,The 3540-ton Alfonso Penna was torpedoed & sunk by the Italian submarine Barbarigo,UNKNOWN,UNKNOWN,"33 crew & 92 passengers were lost, it was thought that some were killed by sharks  FATAL",Y,19h00,UNKNOWN
Morobe Province,"Known as The Battle of the Bismarck Sea :  8 Japanese destroyers guarding a convoy of 8 transports were attacked by 129 Allied fighters, 207 bombers & 3 squadrons of the Royal Australian Air Force. ",UNKNOWN,UNKNOWN,"An estimated  3,000 to 7,000 Japanese troops perished, some were taken by sharks",Y,UNKNOWN,UNKNOWN
Northwest of Papua New Guinea,The USS Wahoo torpedoes & sank the Japanese troop transport Buyo Maru,M,UNKNOWN,FATAL,Y,UNKNOWN,UNKNOWN
Veracruz,Swimming,UNKNOWN,UNKNOWN,FATAL,Y,UNKNOWN,UNKNOWN
UNKNOWN,Swimming,M,UNKNOWN,Arm severed,N,UNKNOWN,UNKNOWN
UNKNOWN,Swimming,M,22,"Right arm severed, left foot bitten",N,UNKNOWN,UNKNOWN
Hawaii,Spearfishing,M,UNKNOWN,Calf nipped in each case,N,UNKNOWN,"""small sharks"""
Hawaii,Spearfishing,M,UNKNOWN,Calf nipped in each case,N,UNKNOWN,"""small sharks"""
Hawaii,UNKNOWN,M,UNKNOWN,"Unprovoked, but circumstances unknown",UNKNOWN,UNKNOWN,UNKNOWN
New South Wales,Dog paddling or standing,F,15,"FATAL, legs bitten ",Y,10h50,Bull shark
KwaZulu-Natal,U-177 torpedoed & sank the troopship Nova Scotia,M,UNKNOWN,"192 survived, but 750 perished. Many were taken by sharks, including Levine",Y,09h30,"1.8 m to 2.4 m [6 to 8] sharks, most were oceanic whitetip sharks"
KwaZulu-Natal,Swimming,M,38,"Calf bitten, leg surgically amputated",N,UNKNOWN,UNKNOWN
UNKNOWN,Thrown from destroyer when shell hit,M,19,Hip bitten,N,UNKNOWN,UNKNOWN
UNKNOWN,"On 6-Nov-1942, the German submarine U-68 sank the City of Cairo 5 days from Cape Town, survivors took to lifeboats & rafts. On the 15th day, a fireman jumped over the stern & was taken by sharks",M,UNKNOWN,FATAL,Y,UNKNOWN,UNKNOWN
UNKNOWN,"Anti-Aircraft cruiser USS Atlanta (CL,-05) travelling in convoy after the Battle of Midway, encountered a Japanese flotilla  (Battle of Guadalcanal) &, heavily damaged by gunfire, she was lost off Lunga Point. Victim was swimming when bitten.",M,UNKNOWN,"Injured by sharks, but managed to swim ashore 6.5 hours later",N,UNKNOWN,UNKNOWN
UNKNOWN,Explosion & sinking of the USS Juneau after being torpedoed by the submarine  I-85,M,UNKNOWN,"Over a period of a week men in the water died of wounds, thirst & sharks. George Sullivan, the last of the Sullivan brothers, survived for 5 days & then was killed by 3 sharks.",Y,UNKNOWN,UNKNOWN
UNKNOWN,UNKNOWN,M,UNKNOWN,FATAL,Y,UNKNOWN,UNKNOWN
Western Cape Province,Swimming ,M,18,"FATAL, body not recovered",Y,12h30,"White shark, 4.5 m  to 6 m [149"" to 20] according to witnesses"
Between Hawaii and U.S.A.,In rubber dinghy with Captain Eddie Rickenbacker for 21 days. ,M,UNKNOWN,One man drove a knife through rubberized canvas trying to stab a shark & it injured him with its tail PROVOKED INCIDENT,N,UNKNOWN,UNKNOWN
Off South American coast,"Dutch merchant ship Zaandam torpedoed  by the U-174 amidships, sank & dozens of survivors took to rafts & boats. One man, Izzi, who drifted 83 days on a raft related that sharks attacked many men in the water when the ship went down",M,UNKNOWN,FATAL,Y,UNKNOWN,UNKNOWN
Makora-Ulawa Province,"His ship, the US destroyer Duncan DD 485, had been  sunk by crossfire from Japanese warships. He was wearing a kapok lifejacket & using 2 aluminum powder tins for floatation  ",M,25,"Foot, hand, elbow & calf lacerated & abraded, thigh gashed",N,UNKNOWN,UNKNOWN
04.05N-13.23W,The 6015-ton British ship Empire Avocet was torpedoed by the German submarine U-125. ,UNKNOWN,UNKNOWN,Survivors on life rafts were harassed by sharks,N,UNKNOWN,UNKNOWN
UNKNOWN,"The Pacquebot Laconia, enroute to Liverpool with 600 Italian prisoners onboard, was torpedoed by the German submarine  U-156 and only 2 rafts were launched before the ship went down. Unable to board an overcrowded raft, he was swimming.",M,UNKNOWN,"Calf lacerated. He was rescued by German submarine, which sunk. Rescued by Italian submarine, which sunk. Managed to reach Dakar",N,UNKNOWN,UNKNOWN
Queensland,Treading water,M,24,"Right foot severed & calf removed, leg  surgically amputated below the knee",N,16h30,"Tiger shark, 2.4 m to 3 m [8 to 10] "
UNKNOWN,Adrift on life raft,M,UNKNOWN,"FATAL, 2 of the 9 airmen killed by sharks",Y,UNKNOWN,Tiger shark & others
UNKNOWN,Japanese aircraft shot down. He was one of two survivors rescued by the U.S. destroyer Mugford,M,UNKNOWN,Lacerations to left arm,N,UNKNOWN,UNKNOWN
UNKNOWN,The SS Potlach was torpedoed & sunk by the U-153 on 27-Jun-1942. ,M,32,FATAL Arm bitten,Y,UNKNOWN,UNKNOWN
Liguria,Sculling,M,20,"After he hit the shark with an oar, the shark bit the oar and overturned the boat  PROVOKED INCIDENT",N,UNKNOWN,Porbeagle shark
UNKNOWN,A 210-ton brig was sunk by a Japanese submarine. Some of the survivors were machine-gunned & some were taken by sharks,M,UNKNOWN,FATAL,Y,UNKNOWN,UNKNOWN
UNKNOWN,boat capsized during filming,M,UNKNOWN,"Remains  recovered from 440-lb shark, but cause of death was probably drowning",UNKNOWN,UNKNOWN,Shark involvement prior to death unconfirmed
Midway Atoll,"Plane crashed in water, men in life raft",M,UNKNOWN,Survived,N,UNKNOWN,UNKNOWN
300 miles east of St. Thomas (Virgin Islands),On life raft tethered to lifeboat. A seaman put hand over side to rinse a cup,M,UNKNOWN,Forearm lacerated,N,UNKNOWN,UNKNOWN
Queensland,Diving from lugger,M,UNKNOWN,"Hands, arms & knee lacerated",N,UNKNOWN,UNKNOWN
West of Ceylon (Sri  Lanka),H.M.S. Cornwall & H.M.S.Dorsetshire sunk by Japanese dive bombers. Officers & men in the water formed a circle with 60 of their dead in the center for 36 hours,UNKNOWN,UNKNOWN,Sharks were numerous & took corpses but made no attempts to harm the survivors.,UNKNOWN,UNKNOWN,Invalid
Guantanamo Province,Esso Bolivar was torpedoed & shelled by the German submarine U-126,M,UNKNOWN,"Of her crew of 50, eight perished, including the two injured men",Y,UNKNOWN,UNKNOWN
New South Wales,UNKNOWN,M,18,"Cause of death was drowning, shark bites were post mortem",UNKNOWN,UNKNOWN,Invalid
New South Wales,UNKNOWN,UNKNOWN,UNKNOWN,Paddle of surf ski bitten by shark,N,UNKNOWN,UNKNOWN
New South Wales,Swimming,F,28,"FATAL, bitten in two  ",Y,15h00,"Bull shark, 4 m [13] "
New South Wales,Surf-skiing,M,UNKNOWN,Attempted to frighten shark by smacking water with paddle. Shark bit paddle.  No injury to surf-skier PROVOKED INCIDENT,N,UNKNOWN,3 m [10] shark
East Java,Captured Allied soldiers were squeezed into 3 bamboo pig baskets & fed to waiting sharks,M,UNKNOWN,"General Imamura, Commander in Chief of Japanese forces in Java was sentenced to 10 years imprisonment by Australian Military Court for his role in the ""Pig Basket Atrocities""",Y,UNKNOWN,UNKNOWN
Tasmania,Fishing for perch,M,UNKNOWN,"No injury to occupants, rudder damaged by shark",N,UNKNOWN,UNKNOWN
Camiguin Island,"Sailing from Gingood, Misamis Oriental to Sagay (normally a 2-day voyage) capsized with 6 on board, three men were taken by sharks when they attempted to swim to shore.",M,UNKNOWN,FATAL,Y,UNKNOWN,UNKNOWN
Western Cape Province,UNKNOWN,UNKNOWN,UNKNOWN,"No injury to occupants, boat rammed by shark",N,UNKNOWN,UNKNOWN
Western Cape Province,UNKNOWN,UNKNOWN,UNKNOWN,No injury,N,UNKNOWN,Said to involve a 6.5 m [21.5] shark
Cay Sal Bank,Swimming along side N.E.L. vessel Saluda,M,48,"Minor injury, ankle scratched by sharks teeth",N,Late afternoon,1.2 m to 1.5 m [4 to 5] shark
UNKNOWN,Jumped overboard from torpedoed Panamanian freighter,M,UNKNOWN,FATAL,Y,UNKNOWN,UNKNOWN
(Southwestern Pacific),"Plane forced down, 3 men on rubber life raft. Put hand over side to feel drift of boat ",M,UNKNOWN,"Fingers badly lacerated, wounds became septic",N,UNKNOWN,UNKNOWN
UNKNOWN,Ditched plane in the sea & were adrift on a rubber life raft. ,M,UNKNOWN,"No injury to occupants, They fought off sharks & killed one with an automatic. Rescued 34 days later",N,UNKNOWN,"Said to be “leopard sharks”, more probably tiger sharks"
UNKNOWN,"Days before the surrender of Singapore, the 3 men escaped to Sumatra where they acquired a 17 dinghy. After 125 days at sea they drifted back to Sumatra",M,UNKNOWN,"No injury to occupants. Sharks continually followed the dinghy, and one smashed its rudder ",N,UNKNOWN,UNKNOWN
Panama City,Swimming,M,UNKNOWN,"FATAL, body not recovered",Y,UNKNOWN,UNKNOWN
UNKNOWN,Torpedoed & burning British  light cruiser with a crew of 450 men,UNKNOWN,UNKNOWN,"Only 170 survived, many of the crew were said to have been taken by sharks",Y,UNKNOWN,"Reportedly: oceanic whitetip sharks, blue sharks, tiger sharks & bull sharks"
Western Australia,Swimming,M,10,Right ankle bitten,N,Night,UNKNOWN
Off Libya,HMAS Parramatta torpedoed & sunk by the U-559,M,23,Right hand severed,N,UNKNOWN,Tiger shark
Off Libya,HMAS Parramatta torpedoed & sunk by the U-559,M,UNKNOWN,Lacerations to chest,N,UNKNOWN,Tiger shark
"North of Pernambuco, Brazil",British cruiser Dunedin torpedoed & sunk by the U-124,UNKNOWN,UNKNOWN,"418 perished, only 67 survived, some of the men were taken by sharks",Y,UNKNOWN,UNKNOWN
Western Australia,German raider Kormoran was sunk in an engagement with HMAS Sydney,M,UNKNOWN,Leg bitten,N,UNKNOWN,UNKNOWN
UNKNOWN,SS Ethel Skakel foundered in Central America Hurricane of 1941,M,UNKNOWN,Leg lacerated FATAL,Y,Night,UNKNOWN
New York,Fishing,UNKNOWN,UNKNOWN,Laceration to left forearm from hooked shark PROVOKED INCIDENT,N,UNKNOWN,UNKNOWN
New South Wales,Swimming,M,UNKNOWN,Shark involvement prior to death unconfirmed,UNKNOWN,UNKNOWN,Shark involvement prior to death unconfirmed
South Carolina,Swimming at edge of channel,M,20,Chest lacerated,N,UNKNOWN,UNKNOWN
New Jersey,Fishing for tuna,UNKNOWN,UNKNOWN,"No injury to occupants, shark leapt into boat & bit cabin door",N,12h00,Mako shark
Hawaii,Fishing,M,UNKNOWN,Arm bitten while removing shark from fishing line PROVOKED INCIDENT,N,UNKNOWN,100-lb shark
